{
  "intentSchemaVersion": "research-dispatch-intent-v1",
  "intentId": "INTENT-20260805-r4n8v2k6qx",
  "taskId": "TASK-N2-010",
  "requestedAction": "run-task",
  "safetyLevel": "L0",
  "expectedAuthoritySha": "00c6f4b",
  "maxDurationSeconds": 3600,
  "requestedBy": "chatgpt-interactive",
  "requestReference": "REQ-20260805-r4n8v2k6qx"
}
