{
  "intentSchemaVersion": "research-dispatch-intent-v1",
  "intentId": "INTENT-20260804-12b44499bf",
  "taskId": "TASK-N2-004",
  "requestedAction": "run-task",
  "safetyLevel": "L0",
  "expectedAuthoritySha": "63c641a",
  "maxDurationSeconds": 1800,
  "requestedBy": "chatgpt-scheduled-task",
  "requestReference": "e2e-neg-notready"
}
